<?xml version="1.0" encoding="utf-8" ?>
<!DOCTYPE Robots SYSTEM "RobotInfo.dtd">
<Robots>

  <Robot>
    <Name>Bender</Name>
    <Description>I have no description.</Description>
    <EntityName>green_robot</EntityName>
  </Robot>

  <Robot>
    <Name>I, Robot</Name>
    <Description>Blah</Description>
    <EntityName>orange_robot</EntityName>
  </Robot>

  <Robot>
    <Name>Terminator</Name>
    <Description>Foo, this is a description.</Description>
    <EntityName>blue_robot</EntityName>
  </Robot>

  <Robot>
    <Name>Marvin</Name>
    <Description>Gugus.</Description>
    <EntityName>purple_robot</EntityName>
  </Robot>

</Robots> 