<?xml version="1.0" encoding="utf-8" ?>
<!DOCTYPE Robots SYSTEM "RobotInfo.dtd">
<Robots>

  <Robot>
    <Name>Givayo</Name>
    <Description>I have no description.</Description>
    <EntityName>green_dwarf</EntityName>
  </Robot>

  <Robot>
    <Name>Famar</Name>
    <Description>Blah</Description>
    <EntityName>orange_dwarf</EntityName>
  </Robot>

  <Robot>
    <Name>Tunira</Name>
    <Description>Foo, this is a description.</Description>
    <EntityName>blue_dwarf</EntityName>
  </Robot>

  <Robot>
    <Name>Yrogr</Name>
    <Description>Gugus.</Description>
    <EntityName>purple_dwarf</EntityName>
  </Robot>

</Robots>